{
  "workspace_id": "demo",
  "project_id": "block_a1",
  "symbols": [
    {
      "id": "sym_f",
      "code": "F",
      "kind": "text",
      "meaning": "3F 용접장 각장 (뒤의 숫자가 각장 mm)",
      "aliases": [],
      "welding_joint_type": "FILLET"
    },
    {
      "id": "sym_v",
      "code": "V",
      "kind": "text",
      "meaning": "2F 용접장 각장 (뒤의 숫자가 각장 mm)",
      "aliases": [],
      "welding_joint_type": "FILLET"
    },
    {
      "id": "sym_s",
      "code": "S",
      "kind": "text",
      "meaning": "스티프너 각장 (뒤의 숫자가 각장 mm)",
      "aliases": [],
      "welding_joint_type": "FILLET"
    },
    {
      "id": "sym_fw",
      "code": "FW",
      "kind": "text",
      "meaning": "필렛 용접 (Fillet Weld)",
      "aliases": [
        "F/W"
      ],
      "welding_joint_type": "FILLET"
    },
    {
      "id": "sym_bv",
      "code": "BV",
      "kind": "text",
      "meaning": "V형 맞대기 용접 (Butt V-groove)",
      "aliases": [],
      "welding_joint_type": "BUTT_V"
    },
    {
      "id": "sym_field",
      "code": "▲",
      "kind": "symbol",
      "meaning": "현장 용접 표시",
      "aliases": [],
      "welding_joint_type": null
    }
  ],
  "assembly_tree": [
    {
      "node_id": "A1",
      "parent_id": null,
      "level": "BLOCK",
      "path": "A1"
    },
    {
      "node_id": "L1",
      "parent_id": "A1",
      "level": "LARGE",
      "path": "A1/L1"
    },
    {
      "node_id": "M2",
      "parent_id": "L1",
      "level": "MID",
      "path": "A1/L1/M2"
    },
    {
      "node_id": "S1",
      "parent_id": "M2",
      "level": "SUB",
      "path": "A1/L1/M2/S1"
    },
    {
      "node_id": "S2",
      "parent_id": "M2",
      "level": "SUB",
      "path": "A1/L1/M2/S2"
    },
    {
      "node_id": "P-1",
      "parent_id": "S1",
      "level": "PART",
      "path": "A1/L1/M2/S1/P-1"
    },
    {
      "node_id": "P-2",
      "parent_id": "S1",
      "level": "PART",
      "path": "A1/L1/M2/S1/P-2"
    },
    {
      "node_id": "P-3",
      "parent_id": "S2",
      "level": "PART",
      "path": "A1/L1/M2/S2/P-3"
    }
  ],
  "welding_standards": [
    {
      "joint_type": "FILLET",
      "thickness_min_mm": 6.0,
      "thickness_max_mm": 12.0,
      "process": "FCAW",
      "position": "FLAT",
      "current_a": "220-260",
      "voltage_v": "26-30",
      "speed_cm_min": "30-40"
    },
    {
      "joint_type": "FILLET",
      "thickness_min_mm": 12.0,
      "thickness_max_mm": 20.0,
      "process": "FCAW",
      "position": "FLAT",
      "current_a": "250-290",
      "voltage_v": "28-32",
      "speed_cm_min": "25-35"
    },
    {
      "joint_type": "BUTT_V",
      "thickness_min_mm": 10.0,
      "thickness_max_mm": 20.0,
      "process": "FCAW",
      "position": "FLAT",
      "current_a": "200-240",
      "voltage_v": "25-29",
      "speed_cm_min": "20-30"
    }
  ],
  "user_context": null,
  "corrections": [],
  "previous_reading": null,
  "related_jobs": []
}
